{
  "case_id": "FED-POS-001",
  "expected": {
    "accepted": true,
    "code": "FEDERATION_CREATED",
    "enforcement": "NOT_APPLICABLE",
    "semantic_status": "NOT_APPLICABLE",
    "state_changed": true
  },
  "initial_state": null,
  "polarity": "positive",
  "steps": [
    {
      "kind": "FEDERATION_GENESIS",
      "payload": {
        "constitution_digest": "sha256:0000000000000000000000000000000000000000000000000000000000000000",
        "federation_epoch": 0,
        "federation_id": "fed:1"
      },
      "transition_id": "t:1"
    }
  ]
}
