{
  "case_id": "FED-POS-004",
  "expected": {
    "accepted": true,
    "code": "ARTIFACT_EXPORTED",
    "enforcement": "NOT_APPLICABLE",
    "semantic_status": "NOT_APPLICABLE",
    "state_changed": true
  },
  "initial_state": null,
  "polarity": "positive",
  "steps": [
    {
      "kind": "FEDERATION_GENESIS",
      "payload": {
        "constitution_digest": "sha256:0000000000000000000000000000000000000000000000000000000000000000",
        "federation_epoch": 0,
        "federation_id": "fed:1"
      },
      "transition_id": "t:1"
    },
    {
      "kind": "MEMBER_JOIN",
      "payload": {
        "member": {
          "authority_digest": "sha256:bbbbbbbbbbbbbbbbbbbbbbbbbbbbbbbbbbbbbbbbbbbbbbbbbbbbbbbbbbbbbbbb",
          "constitution_digest": "sha256:aaaaaaaaaaaaaaaaaaaaaaaaaaaaaaaaaaaaaaaaaaaaaaaaaaaaaaaaaaaaaaaa",
          "context_id": "ctx:A",
          "policy_epoch": 1,
          "status": "ACTIVE"
        }
      },
      "transition_id": "t:2"
    },
    {
      "kind": "MEMBER_JOIN",
      "payload": {
        "member": {
          "authority_digest": "sha256:dddddddddddddddddddddddddddddddddddddddddddddddddddddddddddddddd",
          "constitution_digest": "sha256:cccccccccccccccccccccccccccccccccccccccccccccccccccccccccccccccc",
          "context_id": "ctx:B",
          "policy_epoch": 4,
          "status": "ACTIVE"
        }
      },
      "transition_id": "t:3"
    },
    {
      "kind": "ROUTE_GRANT",
      "payload": {
        "route": {
          "grant_digest": "sha256:ffffffffffffffffffffffffffffffffffffffffffffffffffffffffffffffff",
          "route_id": "route:A-B",
          "scope_digest": "sha256:eeeeeeeeeeeeeeeeeeeeeeeeeeeeeeeeeeeeeeeeeeeeeeeeeeeeeeeeeeeeeeee",
          "source_context_id": "ctx:A",
          "source_policy_epoch": 1,
          "status": "ACTIVE",
          "target_context_id": "ctx:B",
          "target_policy_epoch": 4
        }
      },
      "transition_id": "t:4"
    },
    {
      "kind": "EXPORT_ARTIFACT",
      "payload": {
        "export": {
          "artifact_digest": "sha256:1111111111111111111111111111111111111111111111111111111111111111",
          "export_id": "export:1",
          "route_id": "route:A-B",
          "scope_digest": "sha256:eeeeeeeeeeeeeeeeeeeeeeeeeeeeeeeeeeeeeeeeeeeeeeeeeeeeeeeeeeeeeeee",
          "source_context_id": "ctx:A",
          "source_policy_epoch": 1,
          "source_state_root": "sha256:2222222222222222222222222222222222222222222222222222222222222222",
          "target_context_id": "ctx:B"
        }
      },
      "transition_id": "t:5"
    }
  ]
}
