{
  "case_id": "NET-NEG-001",
  "expected": {
    "accepted": false,
    "code": "IDENTIFIER_CONFLICT",
    "enforcement": "BLOCKED",
    "semantic_status": "UNKNOWN",
    "state_changed": false
  },
  "initial_state": {
    "history": [
      "sha256:134a21710ca600b33b971d5d577ec27509d5a0f0192921fd88727c60c43f75ed"
    ],
    "imports": {
      "imp-001": {
        "enforcement": "BLOCKED",
        "evidence_digest": "sha256:5b181a581a374d0510150c19437e4c6dc266a82ee735affc9bb33cec7f656224",
        "import_id": "imp-001",
        "seed_scope": [
          "network/import"
        ],
        "semantic_status": "UNKNOWN",
        "target_context_id": "ctx-A",
        "target_policy_epoch": 1,
        "target_state_root": "sha256:5a01052272d925b2ab6c3fb46c1df7cf46ab53886e137d8ef116b5a21d85ab70"
      }
    }
  },
  "polarity": "negative",
  "steps": [
    {
      "kind": "ADMIT_IMPORT",
      "payload": {
        "import": {
          "enforcement": "BLOCKED",
          "evidence_digest": "sha256:f5fd4431ef9f46eb87a9cc9901bf5b9dc5749e296b30e423ad9e46042982edfa",
          "import_id": "imp-001",
          "seed_scope": [
            "network/import"
          ],
          "semantic_status": "UNKNOWN",
          "target_context_id": "ctx-A",
          "target_policy_epoch": 1,
          "target_state_root": "sha256:5a01052272d925b2ab6c3fb46c1df7cf46ab53886e137d8ef116b5a21d85ab70"
        }
      },
      "transition_id": "tr-004"
    }
  ]
}
