{
  "case_id": "FED-POS-002",
  "expected": {
    "accepted": true,
    "code": "MEMBER_JOINED",
    "enforcement": "NOT_APPLICABLE",
    "semantic_status": "NOT_APPLICABLE",
    "state_changed": true
  },
  "initial_state": null,
  "polarity": "positive",
  "steps": [
    {
      "kind": "FEDERATION_GENESIS",
      "payload": {
        "constitution_digest": "sha256:0000000000000000000000000000000000000000000000000000000000000000",
        "federation_epoch": 0,
        "federation_id": "fed:1"
      },
      "transition_id": "t:1"
    },
    {
      "kind": "MEMBER_JOIN",
      "payload": {
        "member": {
          "authority_digest": "sha256:bbbbbbbbbbbbbbbbbbbbbbbbbbbbbbbbbbbbbbbbbbbbbbbbbbbbbbbbbbbbbbbb",
          "constitution_digest": "sha256:aaaaaaaaaaaaaaaaaaaaaaaaaaaaaaaaaaaaaaaaaaaaaaaaaaaaaaaaaaaaaaaa",
          "context_id": "ctx:A",
          "policy_epoch": 1,
          "status": "ACTIVE"
        }
      },
      "transition_id": "t:2"
    }
  ]
}
